1,Arkansas Traveler/Red River Valley,The Syncopated Clock/Grandfather's Clock,Peter Pan Singers,0.99,
2,Wild Horses,You're a Heartbreaker,Ray Anthony,1.99,
3,My Birthday Waltz,"Balloons, Balloons, Balloons",Dora Hall,1,
4,Son of a Preacher Man,Just a Little Lovin',Dusty Springfield,1.08,
5,Who Could Ever Doubt My Love,I Hear a Symphony,The Supremes,0.72,
6,When the Saints Go Marching In,The Night Before Christmas,Louis Armstrong,0.5,
7,I Can Hear You Calling,Joy to the World,Three Dog Night,0.49,
8,Travlin' Man,Hey Love,Stevie Wonder,4.99,
9,Playing for Keeps,Too Much,Elvis Presley,0.82,
10,Let Me In,Oh Yes I'll be True,The Sensations,0.99,
11,Do the Boomerang,Tune Up,Junior Walker and the All Stars,2,
12,The Biggest Players,Peaches N Cream,The Ikettes,0.75,
13,Chapel of Love,Ain't That Nice,The Dixie Cups,1.09,
14,Dry Your Eyes,The Wash,Brenda and the Tabulations,0.85,
15,Oh What a Night,Believe Me,The Dells,0.45,
16,Since I Lost My Baby,You've Got to Earn it,The Temptations,0.8,
17,Love on a Two-Way Street,I Won't do Anything,The Moments,0.39,
18,I've Been Good to You,You're my Everything,The Temptations,0.5,
19,Cool Jerk,Hello Stranger,The Capitals,0.9,
20,Stay,Do You Believe,Maurice Williams and the Zodiacs,0.01,
21,All Mixed Up Inside,This Heart of Mine,Butchie Barnes and Ila Marie,16.98,
22,I Wanna Testify,I Can Feel the Ice Melting,The Parliments,1,
23,Cowboys to Girls,Turn the Hands of Time,The Intruders,0.75,
24,"Baby, Baby I Need You",Girl Why You Wanna Make Me Blue,The Temptations,7,
25,You're What's Happening,I Heard it Through the Grapevine,Marvin Gaye,0.75,
26,Tighten Up,Tighten Up Part 2,Archie Bell and The Drells,0.99,
27,I Heard it Through the Grapevine,It's Time to Go Now,Gladys Knight and The Pips,0.55,
28,Born Poor,The Rapper,The Jaggerz,0.59,
29,Moment of Truth,"Baby, I'm For Real",The Originals,0.85,
30,Listen to Me,Get on Up,The Esquires,0.74,
31,Hold On! I'm a Comin',I Got Everything I Need,Sam and Dave,0.89,
32,There He Is,Dancing in the Street,Martha and the Vandellas,0.99,
33,But Its Alright,Boogaloo Baby,J.J.Jackson,0.97,
34,Up and Down the Ladders,Together,The Intruders,0.85,
35,Turn Away From Me,Tell Him,Patti Drew,1.8,
36,I'm a Happy Man,Kiss Kiss Kiss,The Jive Five,0.6,
37,Shake a Tail Feather,Divorce Court,Five Du-Tones,1.08,
38,My Story,Road Runner,Bo Diddley,2,
39,Love You So Bad,Come Home Girl,The Empires,43.01,
40,Please Baby Please,Too Shy,The Sensations,30,
41,You're Gonna Cry,Lover's Island,The Blue Jays,0.97,
42,I Ran All the Way Home,Fool Fool Fool,The Impalas,0.49,
43,Romeo and Juliets 'I Don't Wanna Live Without You',You Gave Me Something ,Fantastic Four,0.54,
44,Magic of Her Love,You Better Believe It,Jimmie and Wayne,4.29,
45,Baby I Love You,Bring it Back,The Jaggerz,3,
46,Good Rockin' Daddy,Billy's Bag,Etta James/Billy Preston,2,
47,Do This For Me,Someone,The Lovers,7,
48,Maria Elena,Jungle Dream,Los Indios Tabajaras,0.01,
49,No Time For You,Hey It's Love,The Commands,25,
50,The Loser,Everything is Fine,The Skyliners,1.96,
51,We'll Be United,Up and Down the Ladder,The Intruders,1.08,
52,Dedicated to You,Trouble Child,Barabara Mason,47.56,
53,Guided Missiles,My Heart,The Cufflinks,2,
54,If Your Mother Only Knew,Way Over There,The Miracles,10.75,
55,That's What Girls Are Made For,Heebie Jeebies,The Spinners,1,
56,Ain't That the Truth,Shoot Your Shot,Junior Walker and the All Stars,1.34,
57,I've Never Found a Girl,I'm Just the Kind of Fool,Eddie Floyd,1,
58,Forever,Locking Up My Heart,The Marvelettes,1,
59,Take Me Back,Our Song,Little Anthony and the Imperials,0.5,
60,Twenty Five Miles,Love is My Destination,Edwin Starr,0.25,
61,Chain Gang/Bungaree Dolt,See You Later Alligator/Go on With the Wedding,Danny Daniels/Bud Roman/Sue Richards,2.5,
62,Uptown,What a Nice Way to Turn Seventeen,The Chrystals,0.45,
63,I'm So Glad I Found You,Look Over Your Shoulder,The O'Jays,2,
64,Piece of My Heart,"Baby, What You Want Me to Do",Erma Franklin,0.5,
65,Win or Lose,I've Got to Have You,Fantastic Four,0.22,
66,And I Always Will,THe FIfe Piper,The Dynatones,0.99,
67,Flame of Love,I Know Better,The Flamingos,1.08,
68,Go! Head On,Hole in the Wall,The Packers,0.98,
69,Find Me,Find Me,Attractions,7.51,defect?
70,You Know,You Better Go,Derek Martin,0.99,
71,High on a Hill,When,Scott English,0.61,
72,Old Love,You Beat Me to the Punch,Mary Wells,0.99,
73,The Slop,Big Boy Pete,The Olympics,0.6,
74,Friday Night,Stand in For Love,The O'Jays,0.97,
75,If You Want to,Pretty Little Thing,The Carousels,3.75,
76,It Must Be Love,Don't Let Her Be Your Baby,The Contours,2.9,
77,I've Got to Have Her,Karate,The Emperors,1.8,
78,"Happy, Happy Birthday Baby",Ol Man RIver,The Tune Weavers,0.45,
79,Shine Again,Kiss-A-Kiss,The Adelphis,10,
80,Bring My Daddy Home,City of Strangers,Chuck Corby and the Entrees,195,
81,Watch the Flowers Grow,Raven,The 4 Seasons,0.5,
82,Just Walk in My Shoes,Stepping Closer to Your Heart,Gladys Knight and The Pips,18.99,
83,Tie A String Around Your Finger,My Daddy Knows Best,The Marvelettes,0.99,
84,Run Run Run,I'm Giving You Your Freedom,The Supremes,2.94,
85,Where is the Party ,Something I Want to Tell You,Johnny and the Expressions,0.5,
86,Young World,Summertime,Rick Nelson,0.38,
87,I ain't the Worryin' Kind,Isn't it Lonely Together,O.C.Smith,0.6,
88,Back to the Days of the Romans,Don't Stop Me,Lou Christie,4,
89,I'm Sorry,Get it From the Bottom,The Steelers,1.99,
90,Swish FIsh,39-21-46,The Showmen,0.97,
91,Feelin' Fine,No Matter What Shape,The T-Bones,0.48,
92,You're So Fine and Sweet,I Like it Like That,The Miracles,1.29,
93,Shake,From Way Out to Way Under,Shadows of Night,0.99,
94,Go Little Willie,Emulsified,Rex Garvin and the Mighty Cravers,26.47,
95,Ooh Baby,Back to School,Bo Diddley,1,
96,My Place,Everyday of My Life,The Augustine Twins,19.03,
97,Lickin Stick,So Long Goodbye,George Torrence and the Naturals,1.45,
98,He Will Break Your Heart,"Oh, How I Wish She Were Mine",Timothy Wilson,24.39,
99,4 Steps to Love,Image of a Girl,Safaris,0.49,
100,Stormy,24 Hours of Loneliness,Classics IV,0.35,
101,You'll Soon Be Gone,If This is Love,The Precisions,14.99,
102,Lovely Dee,You're On Top,The Untouchables,1,
103,Heartbreak Road,The Man in You,The Miracles,1,
104,Funky Broadway Part 1,Funky Broadway Part 2,Dyke and the Blazers,0.89,
105,How Does it Feel,Crack Up Laughing,The O'Jays,1.99,
106,Country Fool,It Will Stand,The Showmen,1,
107,Does Your Mame Know About Me,Fading Away,Bobby Taylor and the Vancouvers,0.72,
108,First I Look At The Purse,Searching for a Girl,The Contours,2.5,
109,Long Black Limousine,Little Green Apples,O.C.Smith,0.35,
110,Time on Your Side,Reach Out of the Darkness,Friend and Lover,0.7,
111,Comin Home Baby,More,Kai Winding and Orchestra,0.75,
112,It's True I Love You,Love is Strange,Peaches and Herb,0.69,
113,Don'tcha Hear Me Callin' to ya,Let the Sunshine in,The 5th Dimension,0.19,
114,Water Boy,Didn't it Rain,Evelyn Freeman,4,
115,Summer in the City,Butchies Tune,The Lovin Spoonful,0.35,
116,Kissin in the Kitchen,Duke of Earl,Gene Chandler,0.25,
117,People Get Ready,Time Has Come Today,The Chambers Brothers,0.95,
118,Can't Buy Me Love,You Can't Do That ,The Beatles,0.15,
119,Break Your Promise,Alfie,The Delfonics,0.9,
120,What Good Am I Without You,I Want You Round,Marvin Gaye and Kim Weston,0.99,
121,I'm Sorry,You're Gone,The Delfonics,0.74,
122,Young Girl,I'm Losing You,The Union Gap,0.59,
123,Roscoe James McClain,So in Love,The Tymes,0.1,
124,Keep On Dancing,Make up Your Mind,The Gentrys,0.39,
125,Bread,Sunny,Bobby Hebb,0.1,
126,Hey Diddle Diddle,"Little Darling, I Need You",Marvin Gaye,1.85,
127,I Couldn't Cry if I Wanted To,I'm Losing You,The Temptations,0.5,
128,Rip Van WInkle,For Sentimental Reasons,The Devotions,0.49,
129,A Quiet Tear,This Guy's in Love With You,Herb Alpert,0.01,
130,Blue Velvet,Could This Be Magic,The Dubs,1.75,
131,Ain't Too Proud to Beg,You'll Lose a Precious Love,The Temptations,0.75,
132,Summer Rain,Memory of the Coming Good,Johnny Rivers,0.55,
133,I Gotta Dream On,Mrs Brown You've Got a Lovely Daughter,Herman's Hermits,0.25,
134,Incense and Peppermints,The Birdman of Alkatrash,Strawberry Alarm Clock,0.25,
135,Spooky,Poor People,Classics IV,0.5,
136,This I Know,Daddy's Home,Shep and the Limelites,0.95,
137,Baby I'm For Real,Moment of Truth,The Originals,0.85,